{
  "schema_version": "1.0.0",
  "snapshot_id": "system-eval:2026-09-05-seed",
  "kind": "snapshot",
  "derived_from_snapshot": null,
  "created_at": "2026-09-05T00:00:00Z",
  "evaluation_trigger": "initial_seed",
  "trigger_note": "First declaration of the system evaluation surface itself (AES-V2.14 / SUE-573). Authored before the SUE-570 pilot has run and before any real post-Core operating history exists — every record cited below is a synthetic or placeholder seed used to prove a record shape, not evidence of the system operating.",
  "activation": {
    "sufficiency_conditions": [
      {
        "id": "sue_570_pilot_complete",
        "description": "AES-V2.12 (SUE-570) real suengj.com multi-audience text+visual pilot has run.",
        "met": false,
        "note": "Not started. V2 Core issues (V2.1-V2.11) precede it in the issue map (docs/architecture/V2-EDITORIAL-LEARNING-CORE.md §13)."
      },
      {
        "id": "multiple_owner_reviewed_text_outputs_beyond_pilot",
        "description": "Multiple owner-reviewed text outputs exist beyond the pilot itself.",
        "met": false,
        "note": "feedback/index.json currently lists 2 records, both synthetic seed examples on synthetic subjects, not real owner review."
      },
      {
        "id": "multiple_accepted_rejected_visuals",
        "description": "Multiple accepted/rejected visual outputs exist.",
        "met": false,
        "note": "No visual-job records exist anywhere in the repository yet."
      },
      {
        "id": "real_feedback_routing_revision_cases",
        "description": "Several real feedback -> routing -> revision cases exist.",
        "met": false,
        "note": "feedback/records holds 2 synthetic seed records; there is no revision/replan lineage field to trace a routing decision to an actual repair outcome (see known_gaps)."
      },
      {
        "id": "durable_calibration_decision_or_confirmed_unnecessary",
        "description": "At least one durable calibration decision exists, or there is enough evidence to confirm none was needed.",
        "met": false,
        "note": "AES-V2.10 (calibration/) is concurrent, in-progress work as of this snapshot; no durable, evidence-backed calibration decision has been evaluated yet."
      },
      {
        "id": "cross_agent_model_comparison_evidence",
        "description": "Cross-agent/model comparison evidence exists.",
        "met": false,
        "note": "AES-V2.11 (SUE-569) certification has not yet produced in-repo comparison evidence."
      },
      {
        "id": "reference_selection_behavior_observed",
        "description": "Enough operation exists to observe real reference-selection behavior.",
        "met": false,
        "note": "Only 3 external reference evaluations exist (references/index.json); no selection-in-production has been observed."
      }
    ],
    "overall": "not_yet_sufficient",
    "rationale": "Zero real generation/feedback cycles have occurred. Every record under feedback/, references/evaluations/, and evals/real-output-corpus/entries/ is a synthetic or explicitly-marked placeholder used to prove the record shape, not operating evidence. Running a full system review before SUE-570 would evaluate the absence of a system, not the system, which is exactly the vanity-health failure this surface exists to prevent. This judgement is deliberately revisable: a future reviewer should re-declare it, not simply extend this one, once real operating evidence starts to accumulate."
  },
  "dimensions": [
    {
      "id": "quality_lift",
      "asks": "Does V2 materially improve accepted output quality and adaptability, using real owner-reviewed evidence rather than only synthetic evals?",
      "evidence_sources": [
        "feedback/records — feedback-record.schema.json instances: signal=objective_quality, owner_verdict",
        "feedback/index.json#records — derived per-record summary index",
        "evals/real-output-corpus/entries — corpus-entry.schema.json instances: owner_verdict, dimensions.strong, dimensions.weak, reference_eligible",
        "schemas/l1-review.schema.json#outcome — comparative PASS/REWORK/TIE/ABSTAIN outcome shape; no populated L1 review store exists yet",
        "evals/rubric.json — L0 synthetic rubric baseline, structurally distinct from real owner-reviewed quality lift and never a substitute for it"
      ],
      "judgement_rules": {
        "healthy": "Multiple real owner-reviewed outputs (beyond the SUE-570 pilot) show accepted-quality improvement or materially distinct, integrity-preserving audience transformations, corroborated by L1 comparative PASS outcomes against relevant references, without synthetic-only evidence standing in for real review.",
        "watch": "Real evidence exists but is thin, mixed, or flat — e.g. the accepted/rejected ratio is not improving, or L1 REWORK outcomes recur on the same dimension without resolution.",
        "structural_risk": "Real owner-reviewed evidence shows quality flat or declining despite added machinery, or a content-type/audience transformation cannot be shown materially distinct from another without an integrity cost."
      },
      "insufficient_evidence_when": "No real owner-reviewed feedback or corpus entries exist yet — only synthetic/placeholder seed records that prove the schema shape, not system performance.",
      "state": "INSUFFICIENT_EVIDENCE",
      "evidence_refs": [
        "feedback/index.json#records — 2 records total, both synthetic seed examples",
        "evals/real-output-corpus/entries — 5 entries total, all synthetic or explicitly-marked placeholders per evals/real-output-corpus/README.md"
      ],
      "trend": "not_yet_observable",
      "interpretation": "Every quality-relevant record currently in the repository was authored to demonstrate a schema shape, not to report a real owner judgement. There is no basis yet to say V2 is or is not lifting accepted quality.",
      "recommended_action": "Re-evaluate once the SUE-570 pilot and subsequent real review have produced multiple owner-reviewed feedback and corpus entries with owner_verdict values other than unknown."
    },
    {
      "id": "operator_friction",
      "asks": "Is natural-language operation actually staying simple as the system grows, measured by clarification frequency, correction cycles, and cases requiring the owner to name internal files/schemas directly?",
      "evidence_sources": [
        "schemas/editorial-intent.schema.json#clarification — required/asked/resolution fields (0-3 question norm, resolution states)",
        "schemas/examples/intent-blocked-clarification.example.json — illustrative shape only, not a real operating record",
        "docs/architecture/V2-EDITORIAL-LEARNING-CORE.md — §4 natural-language interface principle this dimension is judged against"
      ],
      "judgement_rules": {
        "healthy": "Clarification counts stay within the intake gate's own 0-3 norm across real tasks, the owner rarely names internal files/schemas, and correction cycles trend down or stay stable as the system grows.",
        "watch": "Clarification counts creep upward, or the owner increasingly names internal artifacts (schema/skill/file names) instead of describing intent in natural language, without yet being structural.",
        "structural_risk": "The owner must routinely make manual JSON/repository edits, or the agent recurrently fails to infer profile/routing despite sufficient stated intent."
      },
      "insufficient_evidence_when": "No durable, committed store of real per-task Editorial Intent records exists yet outside schema examples; clarification counts cannot be measured from repository evidence alone until real intake runs accumulate (see known_gaps).",
      "state": "INSUFFICIENT_EVIDENCE",
      "evidence_refs": [
        "schemas/examples/intent-blocked-clarification.example.json — a worked schema example, not a real intake record"
      ],
      "trend": "not_yet_observable",
      "interpretation": "The clarification contract exists and is well-specified, but no real intake session has left a durable record in this repository yet to measure against it.",
      "recommended_action": "Re-evaluate once real natural-language intake sessions (starting with SUE-570) leave enough durable Editorial Intent evidence to count clarification frequency and correction cycles."
    },
    {
      "id": "context_efficiency",
      "asks": "Does progressive disclosure hold as the repository grows, so a larger repository does not imply proportionally larger per-task context?",
      "evidence_sources": [
        "docs/architecture/V2-EDITORIAL-LEARNING-CORE.md — §9 context and cost budget principle",
        "schemas/visual-job.schema.json#context_isolation — permitted_inputs/excluded allowlist, the one enforced context-scoping mechanism that exists today"
      ],
      "judgement_rules": {
        "healthy": "Per-task context/profile/reference loading stays roughly flat as the repository grows, matching the progressive-disclosure design; no whole-repo/full-history loading incidents are observed.",
        "watch": "Occasional unnecessary-context incidents occur but are isolated and quickly corrected.",
        "structural_risk": "Per-task context load grows roughly with repository size, or whole-repo/full-history loading recurs."
      },
      "insufficient_evidence_when": "No schema or record in this repository carries a token/context-size proxy field yet, so context load cannot be measured from committed evidence at all — a structural gap, not merely an observation gap (see known_gaps).",
      "state": "INSUFFICIENT_EVIDENCE",
      "evidence_refs": [
        "schemas/visual-job.schema.json#context_isolation — an enforced allowlist, but not a measurement of how much context was actually loaded"
      ],
      "trend": "not_yet_observable",